{"$schema":"https://json-schema.org/draft/2020-12/schema","$id":"State.schema.json","type":"object","required":["run_id","current_state","events","tasks"],"properties":{"run_id":{"type":"string"},"current_state":{"type":"string"},"events":{"type":"array","items":{"type":"object"}},"tasks":{"type":"array","items":{"type":"object"}},"last_checkpoint_id":{"type":["string","null"]}},"additionalProperties":true}
